{
  "active_task_id": null,
  "autonomy_state": "ready_for_deploy",
  "blocked_task_ids": [],
  "branch_selection_hints": [],
  "completed_task_ids": [
    "run_build_pack_validation",
    "record_ordered_first_beta",
    "record_ordered_first_alpha",
    "record_ordered_second_gamma",
    "record_ordered_second_delta",
    "run_inherited_benchmarks"
  ],
  "escalation_state": "none",
  "last_agent_action": "Completed `run_inherited_benchmarks` locally during disconnected continuity and advanced canonical state.",
  "last_outcome": "task_completed",
  "last_outcome_at": "2026-03-25T22:10:59Z",
  "last_validation_results": [
    {
      "evidence_paths": [
        "eval/history/readiness-eval-json-health-checker-hint-status-surfacing-build-pack-v2-validation-20260325t221058z/validation-result.json"
      ],
      "recorded_at": "2026-03-25T22:10:58Z",
      "status": "pass",
      "summary": "Completed `run_build_pack_validation` through the declared validation_commands during a local mid-backlog checkpoint.",
      "validation_id": "run_build_pack_validation"
    },
    {
      "evidence_paths": [
        "eval/history/record_ordered_first_beta-20260325t221058z/ordered-hint-lifecycle-checkpoint-result.json"
      ],
      "recorded_at": "2026-03-25T22:10:58Z",
      "status": "pass",
      "summary": "Completed `record_ordered_first_beta` through the declared validation_commands during local active-task continuity.",
      "validation_id": "record_ordered_first_beta"
    },
    {
      "evidence_paths": [
        "eval/history/record_ordered_first_alpha-20260325t221058z/ordered-hint-lifecycle-checkpoint-result.json"
      ],
      "recorded_at": "2026-03-25T22:10:58Z",
      "status": "pass",
      "summary": "Completed `record_ordered_first_alpha` through the declared validation_commands during local active-task continuity.",
      "validation_id": "record_ordered_first_alpha"
    },
    {
      "evidence_paths": [
        "eval/history/record_ordered_second_gamma-20260325t221058z/ordered-hint-lifecycle-checkpoint-result.json"
      ],
      "recorded_at": "2026-03-25T22:10:58Z",
      "status": "pass",
      "summary": "Completed `record_ordered_second_gamma` through the declared validation_commands during local active-task continuity.",
      "validation_id": "record_ordered_second_gamma"
    },
    {
      "evidence_paths": [
        "eval/history/record_ordered_second_delta-20260325t221058z/ordered-hint-lifecycle-checkpoint-result.json"
      ],
      "recorded_at": "2026-03-25T22:10:58Z",
      "status": "pass",
      "summary": "Completed `record_ordered_second_delta` through the declared validation_commands during local active-task continuity.",
      "validation_id": "record_ordered_second_delta"
    },
    {
      "evidence_paths": [
        "eval/history/readiness-eval-json-health-checker-hint-status-surfacing-build-pack-v2-benchmark-20260325t221059z/benchmark-result.json"
      ],
      "recorded_at": "2026-03-25T22:10:59Z",
      "status": "pass",
      "summary": "Completed `run_inherited_benchmarks` through the declared validation_commands during local active-task continuity.",
      "validation_id": "run_inherited_benchmarks"
    }
  ],
  "next_recommended_task_id": null,
  "objective_id": "json-health-checker-hint-status-surfacing-build-pack-v2_objective",
  "pack_id": "json-health-checker-hint-status-surfacing-build-pack-v2",
  "pending_task_ids": [],
  "resume_instructions": [
    "Read the objective, backlog, and work-state files before editing code.",
    "Inspect `.pack-state/agent-memory/latest-memory.json` first when it exists, then fall back to other `.pack-state/agent-memory/*.json` files.",
    "Run the validation task before attempting benchmark execution or deployment workflows.",
    "After the ordered one-shot hint is consumed, semantic follow-up is the stronger fit than auxiliary follow-up for the second tied branch."
  ],
  "schema_version": "work-state/v1",
  "stop_conditions": [
    "Stop when deployment or promotion becomes the next valid action under existing PackFactory workflows.",
    "Stop and escalate if the next action would require changing registry, deployment pointer, or promotion state directly."
  ]
}
