{
  "active_task_id": null,
  "autonomy_state": "ready_for_review",
  "blocked_task_ids": [],
  "branch_selection_hints": [],
  "completed_task_ids": [
    "run_build_pack_validation",
    "run_inherited_benchmarks",
    "operator_intake_and_profile_refinement",
    "session_memory_distillation_and_promotion",
    "grounding_and_accountability_cadence",
    "relationship_learning_gap_visibility",
    "business_grounding_review_loop",
    "preference_signal_strength_tracking",
    "navigation_and_fundamentals_guidance_loop",
    "daily_session_continuity_checkpoint",
    "thin_history_enrichment_follow_through",
    "recurring_relationship_reflection_loop"
  ],
  "escalation_state": "none",
  "last_agent_action": "Added a bounded recurring relationship-reflection loop to the runtime and template assistant surfaces, validated the new reflection status and write path locally, and prepared the pack for a focused remote replay of the reflection slice.",
  "last_outcome": "task_completed",
  "last_outcome_at": "2026-03-30T20:49:57Z",
  "last_validation_results": [
    {
      "evidence_paths": [
        "eval/history/readiness-eval-codex-personal-assistant-daily-driver-build-pack-v1-validation-20260329t161748z/validation-result.json"
      ],
      "recorded_at": "2026-03-29T16:17:48Z",
      "status": "pass",
      "summary": "Recorded passing validation readiness evidence for the build-pack contract.",
      "validation_id": "run_build_pack_validation"
    },
    {
      "evidence_paths": [
        "eval/history/readiness-eval-codex-personal-assistant-daily-driver-build-pack-v1-benchmark-20260329t161814z/benchmark-result.json"
      ],
      "recorded_at": "2026-03-29T16:18:14Z",
      "status": "pass",
      "summary": "Recorded passing inherited benchmark readiness evidence for the assistant smoke path.",
      "validation_id": "run_inherited_benchmarks"
    }
  ],
  "next_recommended_task_id": null,
  "objective_id": "codex-personal-assistant-daily-driver-build-pack-v1_objective",
  "pack_id": "codex-personal-assistant-daily-driver-build-pack-v1",
  "pending_task_ids": [],
  "resume_instructions": [
    "Read the objective, backlog, and work-state files before editing code.",
    "Inspect `.pack-state/agent-memory/latest-memory.json` first when it exists, then fall back to other `.pack-state/agent-memory/*.json` files.",
    "Inspect the operator-intake, session-distillation, operator-profile, memory-policy, and partnership-policy surfaces before changing assistant behavior.",
    "Inspect show-business-review, show-relationship-reflection, show-memory-distillation, and the next remote UAT roundtrip state before choosing the next assistant-behavior slice."
  ],
  "schema_version": "work-state/v1",
  "stop_conditions": [
    "Stop when the current recurring relationship-reflection slice is implemented and existing bounded validation surfaces pass.",
    "Stop and escalate if the next action would require changing registry, deployment pointer, or promotion state directly."
  ]
}
