{
  "active_task_id": "run_inherited_benchmarks",
  "autonomy_state": "actively_building",
  "blocked_task_ids": [],
  "completed_task_ids": [
    "run_build_pack_validation"
  ],
  "escalation_state": "none",
  "last_agent_action": "Completed `run_build_pack_validation` locally and stopped at a mid-backlog checkpoint with `run_inherited_benchmarks` as the canonical next task.",
  "last_outcome": "task_completed",
  "last_outcome_at": "2026-03-25T16:10:28Z",
  "last_validation_results": [
    {
      "evidence_paths": [
        "eval/history/readiness-eval-json-health-checker-multi-hop-autonomy-build-pack-v1-validation-20260325t161028z/validation-result.json"
      ],
      "recorded_at": "2026-03-25T16:10:28Z",
      "status": "pass",
      "summary": "Completed `run_build_pack_validation` through the declared validation_commands during a local mid-backlog checkpoint.",
      "validation_id": "run_build_pack_validation"
    }
  ],
  "next_recommended_task_id": "run_inherited_benchmarks",
  "objective_id": "json-health-checker-multi-hop-autonomy-build-pack-v1_objective",
  "pack_id": "json-health-checker-multi-hop-autonomy-build-pack-v1",
  "pending_task_ids": [],
  "resume_instructions": [
    "Read the objective, backlog, and work-state files before editing code.",
    "Inspect `.pack-state/agent-memory/latest-memory.json` first when it exists, then fall back to other `.pack-state/agent-memory/*.json` files.",
    "Run the validation task before attempting benchmark execution or deployment workflows."
  ],
  "schema_version": "work-state/v1",
  "stop_conditions": [
    "Stop when deployment or promotion becomes the next valid action under existing PackFactory workflows.",
    "Stop and escalate if the next action would require changing registry, deployment pointer, or promotion state directly."
  ]
}
