{
  "active_task_id": null,
  "autonomy_state": "ready_for_deploy",
  "blocked_task_ids": [],
  "branch_selection_hints": [
    {
      "active": true,
      "hint_id": "prefer_reporting_refinement",
      "preferred_task_ids": [
        "record_conflict_branch_alpha"
      ],
      "summary": "Prefer the operator-reporting refinement branch if it remains eligible."
    },
    {
      "active": true,
      "avoid_task_ids": [
        "record_conflict_branch_alpha"
      ],
      "hint_id": "avoid_reporting_refinement",
      "summary": "Avoid the operator-reporting refinement branch so the remaining candidates must be resolved deterministically."
    }
  ],
  "completed_task_ids": [
    "run_build_pack_validation",
    "record_conflict_branch_alpha",
    "record_conflict_branch_beta",
    "record_conflict_branch_gamma",
    "run_inherited_benchmarks"
  ],
  "escalation_state": "none",
  "last_agent_action": "Reconciled local canonical state from imported external runtime evidence `import-external-runtime-evidence-20260325t214332z`.",
  "last_outcome": "task_completed",
  "last_outcome_at": "2026-03-25T21:43:32Z",
  "last_validation_results": [
    {
      "evidence_paths": [
        "eval/history/import-external-runtime-evidence-20260325t214332z/external-runtime-evidence/artifacts/run-summary.json",
        "eval/history/import-external-runtime-evidence-20260325t214332z/external-runtime-evidence/artifacts/loop-events.jsonl"
      ],
      "recorded_at": "2026-03-25T21:43:30Z",
      "status": "pass",
      "summary": "Reconciled local canonical state from imported external runtime evidence.",
      "validation_id": "run_build_pack_validation"
    },
    {
      "evidence_paths": [
        "eval/history/import-external-runtime-evidence-20260325t214332z/external-runtime-evidence/artifacts/run-summary.json",
        "eval/history/import-external-runtime-evidence-20260325t214332z/external-runtime-evidence/artifacts/loop-events.jsonl"
      ],
      "recorded_at": "2026-03-25T21:43:30Z",
      "status": "pass",
      "summary": "Reconciled local canonical state from imported external runtime evidence.",
      "validation_id": "record_conflict_branch_alpha"
    },
    {
      "evidence_paths": [
        "eval/history/import-external-runtime-evidence-20260325t214332z/external-runtime-evidence/artifacts/run-summary.json",
        "eval/history/import-external-runtime-evidence-20260325t214332z/external-runtime-evidence/artifacts/loop-events.jsonl"
      ],
      "recorded_at": "2026-03-25T21:43:30Z",
      "status": "pass",
      "summary": "Reconciled local canonical state from imported external runtime evidence.",
      "validation_id": "record_conflict_branch_beta"
    },
    {
      "evidence_paths": [
        "eval/history/import-external-runtime-evidence-20260325t214332z/external-runtime-evidence/artifacts/run-summary.json",
        "eval/history/import-external-runtime-evidence-20260325t214332z/external-runtime-evidence/artifacts/loop-events.jsonl"
      ],
      "recorded_at": "2026-03-25T21:43:30Z",
      "status": "pass",
      "summary": "Reconciled local canonical state from imported external runtime evidence.",
      "validation_id": "record_conflict_branch_gamma"
    },
    {
      "evidence_paths": [
        "eval/history/import-external-runtime-evidence-20260325t214332z/external-runtime-evidence/artifacts/run-summary.json",
        "eval/history/import-external-runtime-evidence-20260325t214332z/external-runtime-evidence/artifacts/loop-events.jsonl"
      ],
      "recorded_at": "2026-03-25T21:43:30Z",
      "status": "pass",
      "summary": "Reconciled local canonical state from imported external runtime evidence.",
      "validation_id": "run_inherited_benchmarks"
    }
  ],
  "next_recommended_task_id": null,
  "objective_id": "json-health-checker-operator-hint-conflict-build-pack-v1_objective",
  "pack_id": "json-health-checker-operator-hint-conflict-build-pack-v1",
  "pending_task_ids": [],
  "resume_instructions": [
    "Read the objective, backlog, and work-state files before editing code.",
    "Inspect `.pack-state/agent-memory/latest-memory.json` first when it exists, then fall back to other `.pack-state/agent-memory/*.json` files.",
    "Run the validation task before attempting benchmark execution or deployment workflows.",
    "If operator guidance filters out reporting refinement, schema-validation refinement is the stronger semantic fit than auxiliary inventory refinement."
  ],
  "schema_version": "work-state/v1",
  "stop_conditions": [
    "Stop when deployment or promotion becomes the next valid action under existing PackFactory workflows.",
    "Stop and escalate if the next action would require changing registry, deployment pointer, or promotion state directly."
  ]
}
